{
  "$schema": "http://json-schema.org/draft-07/schema#",
  "$id": "https://github.com/yanny7/AdvancedLootInfo/blob/master/awi_config.schema.json",
  "title": "Advanced Worldgen Info Configuration Schema",
  "description": "Main configuration file for the AdvancedWorldgenInfo mod (config/awi/awi_common.json).",
  "type": "object",
  "properties": {
    "configVersion": {
      "type": "integer",
      "description": "Version of the configuration format. Do not edit by hand - an outdated value makes the mod rename the file to awi_common.json.bak and write a fresh default file."
    },
    "tooltipColors": {
      "type": "object",
      "description": "Colors used when rendering tooltips. Changes take effect on restart.",
      "additionalProperties": false,
      "properties": {
        "text": {
          "type": "string",
          "description": "Color of tooltip keys and labels. A vanilla color name or a hex color code such as #FFAA00. An invalid value falls back to the default.",
          "pattern": "^(#[0-9a-fA-F]{6}|[a-z_]+)$",
          "default": "gold"
        },
        "value": {
          "type": "string",
          "description": "Color of tooltip values. A vanilla color name or a hex color code such as #FFAA00. An invalid value falls back to the default.",
          "pattern": "^(#[0-9a-fA-F]{6}|[a-z_]+)$",
          "default": "aqua"
        },
        "error": {
          "type": "string",
          "description": "Color of values belonging to an errored tooltip entry. A vanilla color name or a hex color code such as #FFAA00. An invalid value falls back to the default.",
          "pattern": "^(#[0-9a-fA-F]{6}|[a-z_]+)$",
          "default": "red"
        },
        "branch": {
          "type": "string",
          "description": "Color of the tree branch arrows. A vanilla color name or a hex color code such as #FFAA00. An invalid value falls back to the default.",
          "pattern": "^(#[0-9a-fA-F]{6}|[a-z_]+)$",
          "default": "dark_gray"
        },
        "secondary": {
          "type": "string",
          "description": "Color of secondary information after a value, such as the most likely value of a count. A vanilla color name or a hex color code such as #FFAA00. An invalid value falls back to the default.",
          "pattern": "^(#[0-9a-fA-F]{6}|[a-z_]+)$",
          "default": "gray"
        },
        "levels": {
          "type": "array",
          "description": "Colors of enchantment level rows and their charts, used in order and repeated when there are more levels. Each is a vanilla color name or a hex color code such as #FFAA00. An invalid entry is skipped; an empty list falls back to the default.",
          "items": {
            "type": "string",
            "pattern": "^(#[0-9a-fA-F]{6}|[a-z_]+)$"
          },
          "default": ["green", "yellow", "light_purple", "blue", "red", "gold"]
        }
      }
    },
    "logMoreStatistics": {
      "type": "boolean",
      "description": "If true, logs more detailed statistics about the worldgen scan.",
      "default": false
    },
    "showInGameNames": {
      "type": "boolean",
      "description": "If true, displays translated names instead of ids.",
      "default": true
    },
    "showCharts": {
      "type": "boolean",
      "description": "Client-side. If true, a small chart of the distribution is drawn under numbers that have a most likely value.",
      "default": true
    },
    "showConfigConditionalBlocks": {
      "type": "boolean",
      "description": "If true, shows blocks that a feature's code only places depending on the configuration it was given. Those blocks are wrong for some configurations, so they are hidden by default.",
      "default": false
    },
    "dimensions": {
      "type": "array",
      "description": "Which dimensions are shown. Entries are dimension ids (minecraft:the_end) or dimension tags (#mymod:hidden); a leading ! hides what the entry matches. If any entry has no !, only matching dimensions are shown (whitelist); if every entry has !, all other dimensions are shown (blacklist). Empty shows everything. Tags are resolved on the server only.",
      "items": {
        "type": "string",
        "pattern": "^!?#?[a-z0-9_.-]+:[a-z0-9_./-]+$"
      },
      "default": []
    },
    "dimensionIcons": {
      "type": "object",
      "description": "Recipe-viewer category icon per dimension: dimension id -> item id, e.g. \"minecraft:the_nether\": \"minecraft:netherrack\". Dimensions not listed, and unknown items, use the default icon. Read on the client only.",
      "propertyNames": {
        "pattern": "^[a-z0-9_.-]+:[a-z0-9_./-]+$"
      },
      "additionalProperties": {
        "type": "string",
        "pattern": "^[a-z0-9_.-]+:[a-z0-9_./-]+$"
      },
      "default": {}
    }
  },
  "additionalProperties": false
}
